{
  "ir_version": "0.13",
  "format": "0.9",
  "source": {
    "file": "assets/procurement/primary/charger-buck.teda",
    "line": 1
  },
  "procurement": {
    "board": "charger-buck",
    "role": "primary",
    "selections": [
      {
        "generic": "res-thick-0402",
        "params": [
          {
            "name": "value",
            "value": 10000000000
          },
          {
            "name": "tolerance",
            "value": 10000
          }
        ],
        "part": "rc0402fr-0710kl"
      }
    ]
  }
}
